<?xml version="1.0" encoding="utf-8" ?>
<sourceamazing xmlns="https://codeblessing.org/sourceamazing/sourceamazing-xml-schema"
               xmlns:xsi="http://www.w3.org/2001/XMLSchema-instance"
               xsi:schemaLocation="https://codeblessing.org/sourceamazing/sourceamazing-xml-schema ./schema/sourceamazing-xml-schema.xsd">
    <definitions>
        <htmlPage pageTitleName="Person">
            <htmlPageSection sectionName="Names">
                <htmlInputField fieldName="Firstname" required="true" maxFieldLength="40" />
                <htmlInputField fieldName="Lastname" required="true" maxFieldLength="50" />
            </htmlPageSection>
            <htmlPageSection sectionName="Address">
                <htmlInputField fieldName="Street" required="false" maxFieldLength="60" />
                <htmlInputField fieldName="Zip" required="true" maxFieldLength="15" />
                <htmlInputField fieldName="Town" required="true" maxFieldLength="40" />
                <htmlInputField fieldName="Country" required="true" maxFieldLength="40" />
            </htmlPageSection>
        </htmlPage>
        <htmlPage pageTitleName="Company">
            <htmlPageSection sectionName="Company Information">
                <htmlInputField fieldName="Company Name" required="true" maxFieldLength="200" />
                <htmlInputField fieldName="Company Main Country" required="true" maxFieldLength="40" />
            </htmlPageSection>
        </htmlPage>
    </definitions>
</sourceamazing>
